{
  "$schema": "http://json-schema.org/draft-06/schema#",
  "$id": "https://liveart/config/Social.schema.json",
  "title": "Social",
  "description": "Social configuration",
  "type": "object",
  "version": "1.1.0",
  "properties": {
    "$schema": {
      "type": "string",
      "description": "Reference to JSON Schema of the supported version"
    },
    "instagramClientID": {
      "type": "string"
    },
    "facebookClientID": {
      "type": "string"
    },
    "flickrClientID": {
      "type": "string"
    },
    "googleClientID": {
      "type": "string"
    },
    "authorizedRedirectUrl": {
      "type": "string"
    }
  },
  "required": [],
  "additionalProperties": false
}
